{
  "id": "bottleSent",
  "kind": "system",
  "coordinateSpace": "normalized",
  "fadeDurationMs": 900,
  "strokes": [
    {
      "color": "#34C759",
      "opacity": 0.85,
      "points": [
        { "x": 0.36, "y": 0.52 },
        { "x": 0.44, "y": 0.6 },
        { "x": 0.46, "y": 0.62 }
      ]
    },
    {
      "color": "#34C759",
      "opacity": 0.85,
      "points": [
        { "x": 0.46, "y": 0.62 },
        { "x": 0.54, "y": 0.48 },
        { "x": 0.66, "y": 0.36 }
      ]
    }
  ]
}
