{
  "id": "autoPlayOff",
  "kind": "system",
  "coordinateSpace": "normalized",
  "fadeDurationMs": 2200,
  "strokes": [
    {
      "color": "#34C759",
      "points": [
        {
          "x": 0.5,
          "y": 0.3
        },
        {
          "x": 0.5257,
          "y": 0.3028
        },
        {
          "x": 0.5502,
          "y": 0.311
        },
        {
          "x": 0.5724,
          "y": 0.3243
        },
        {
          "x": 0.5912,
          "y": 0.3421
        },
        {
          "x": 0.6058,
          "y": 0.3634
        },
        {
          "x": 0.6155,
          "y": 0.3874
        },
        {
          "x": 0.6198,
          "y": 0.4129
        },
        {
          "x": 0.6185,
          "y": 0.4388
        },
        {
          "x": 0.6117,
          "y": 0.4637
        },
        {
          "x": 0.5998,
          "y": 0.4867
        },
        {
          "x": 0.5832,
          "y": 0.5065
        },
        {
          "x": 0.5627,
          "y": 0.5223
        },
        {
          "x": 0.5393,
          "y": 0.5334
        },
        {
          "x": 0.5141,
          "y": 0.5392
        },
        {
          "x": 0.4882,
          "y": 0.5394
        },
        {
          "x": 0.4629,
          "y": 0.5341
        },
        {
          "x": 0.4393,
          "y": 0.5235
        },
        {
          "x": 0.4185,
          "y": 0.5081
        },
        {
          "x": 0.4016,
          "y": 0.4886
        },
        {
          "x": 0.3891,
          "y": 0.4659
        },
        {
          "x": 0.3819,
          "y": 0.4411
        },
        {
          "x": 0.3801,
          "y": 0.4153
        },
        {
          "x": 0.3839,
          "y": 0.3897
        },
        {
          "x": 0.3931,
          "y": 0.3655
        }
      ]
    }
  ]
}
