{
  "id": "destinationSelected",
  "kind": "system",
  "coordinateSpace": "normalized",
  "fadeDurationMs": 2200,
  "strokes": [
    {
      "color": "#34C759",
      "points": [
        {
          "x": 0.58,
          "y": 0.36
        },
        {
          "x": 0.5773,
          "y": 0.3807
        },
        {
          "x": 0.5693,
          "y": 0.4
        },
        {
          "x": 0.5566,
          "y": 0.4166
        },
        {
          "x": 0.54,
          "y": 0.4293
        },
        {
          "x": 0.5207,
          "y": 0.4373
        },
        {
          "x": 0.5,
          "y": 0.44
        },
        {
          "x": 0.4793,
          "y": 0.4373
        },
        {
          "x": 0.46,
          "y": 0.4293
        },
        {
          "x": 0.4434,
          "y": 0.4166
        },
        {
          "x": 0.4307,
          "y": 0.4
        },
        {
          "x": 0.4227,
          "y": 0.3807
        },
        {
          "x": 0.42,
          "y": 0.36
        },
        {
          "x": 0.4227,
          "y": 0.3393
        },
        {
          "x": 0.4307,
          "y": 0.32
        },
        {
          "x": 0.4434,
          "y": 0.3034
        },
        {
          "x": 0.46,
          "y": 0.2907
        },
        {
          "x": 0.4793,
          "y": 0.2827
        },
        {
          "x": 0.5,
          "y": 0.28
        },
        {
          "x": 0.5207,
          "y": 0.2827
        },
        {
          "x": 0.54,
          "y": 0.2907
        },
        {
          "x": 0.5566,
          "y": 0.3034
        },
        {
          "x": 0.5693,
          "y": 0.32
        },
        {
          "x": 0.5773,
          "y": 0.3393
        },
        {
          "x": 0.58,
          "y": 0.36
        }
      ]
    },
    {
      "color": "#34C759",
      "points": [
        {
          "x": 0.36,
          "y": 0.5
        },
        {
          "x": 0.38,
          "y": 0.5
        },
        {
          "x": 0.4,
          "y": 0.5
        },
        {
          "x": 0.42,
          "y": 0.5
        },
        {
          "x": 0.44,
          "y": 0.5
        },
        {
          "x": 0.46,
          "y": 0.5
        },
        {
          "x": 0.48,
          "y": 0.5
        },
        {
          "x": 0.5,
          "y": 0.5
        },
        {
          "x": 0.52,
          "y": 0.5
        },
        {
          "x": 0.54,
          "y": 0.5
        },
        {
          "x": 0.56,
          "y": 0.5
        },
        {
          "x": 0.58,
          "y": 0.5
        },
        {
          "x": 0.6,
          "y": 0.5
        },
        {
          "x": 0.62,
          "y": 0.5
        },
        {
          "x": 0.64,
          "y": 0.5
        }
      ]
    },
    {
      "color": "#34C759",
      "opacity": 0.6,
      "points": [
        {
          "x": 0.42,
          "y": 0.56
        },
        {
          "x": 0.44,
          "y": 0.56
        },
        {
          "x": 0.46,
          "y": 0.56
        },
        {
          "x": 0.48,
          "y": 0.56
        },
        {
          "x": 0.5,
          "y": 0.56
        },
        {
          "x": 0.52,
          "y": 0.56
        },
        {
          "x": 0.54,
          "y": 0.56
        },
        {
          "x": 0.56,
          "y": 0.56
        },
        {
          "x": 0.58,
          "y": 0.56
        }
      ]
    }
  ]
}
