{
  "id": "friendConnected",
  "kind": "system",
  "coordinateSpace": "normalized",
  "fadeDurationMs": 2200,
  "strokes": [
    {
      "color": "#34C759",
      "points": [
        {
          "x": 0.37,
          "y": 0.42
        },
        {
          "x": 0.367,
          "y": 0.433
        },
        {
          "x": 0.3587,
          "y": 0.4435
        },
        {
          "x": 0.3467,
          "y": 0.4492
        },
        {
          "x": 0.3333,
          "y": 0.4492
        },
        {
          "x": 0.3213,
          "y": 0.4435
        },
        {
          "x": 0.313,
          "y": 0.433
        },
        {
          "x": 0.31,
          "y": 0.42
        },
        {
          "x": 0.313,
          "y": 0.407
        },
        {
          "x": 0.3213,
          "y": 0.3965
        },
        {
          "x": 0.3333,
          "y": 0.3908
        },
        {
          "x": 0.3467,
          "y": 0.3908
        },
        {
          "x": 0.3587,
          "y": 0.3965
        },
        {
          "x": 0.367,
          "y": 0.407
        },
        {
          "x": 0.37,
          "y": 0.42
        }
      ]
    },
    {
      "color": "#34C759",
      "points": [
        {
          "x": 0.69,
          "y": 0.42
        },
        {
          "x": 0.687,
          "y": 0.433
        },
        {
          "x": 0.6787,
          "y": 0.4435
        },
        {
          "x": 0.6667,
          "y": 0.4492
        },
        {
          "x": 0.6533,
          "y": 0.4492
        },
        {
          "x": 0.6413,
          "y": 0.4435
        },
        {
          "x": 0.633,
          "y": 0.433
        },
        {
          "x": 0.63,
          "y": 0.42
        },
        {
          "x": 0.633,
          "y": 0.407
        },
        {
          "x": 0.6413,
          "y": 0.3965
        },
        {
          "x": 0.6533,
          "y": 0.3908
        },
        {
          "x": 0.6667,
          "y": 0.3908
        },
        {
          "x": 0.6787,
          "y": 0.3965
        },
        {
          "x": 0.687,
          "y": 0.407
        },
        {
          "x": 0.69,
          "y": 0.42
        }
      ]
    },
    {
      "color": "#34C759",
      "points": [
        {
          "x": 0.34,
          "y": 0.42
        },
        {
          "x": 0.3578,
          "y": 0.3992
        },
        {
          "x": 0.3756,
          "y": 0.379
        },
        {
          "x": 0.3933,
          "y": 0.36
        },
        {
          "x": 0.4111,
          "y": 0.3429
        },
        {
          "x": 0.4289,
          "y": 0.3281
        },
        {
          "x": 0.4467,
          "y": 0.3161
        },
        {
          "x": 0.4644,
          "y": 0.3072
        },
        {
          "x": 0.4822,
          "y": 0.3018
        },
        {
          "x": 0.5,
          "y": 0.3
        },
        {
          "x": 0.5178,
          "y": 0.3018
        },
        {
          "x": 0.5356,
          "y": 0.3072
        },
        {
          "x": 0.5533,
          "y": 0.3161
        },
        {
          "x": 0.5711,
          "y": 0.3281
        },
        {
          "x": 0.5889,
          "y": 0.3429
        },
        {
          "x": 0.6067,
          "y": 0.36
        },
        {
          "x": 0.6244,
          "y": 0.379
        },
        {
          "x": 0.6422,
          "y": 0.3992
        },
        {
          "x": 0.66,
          "y": 0.42
        }
      ]
    }
  ]
}
