{
  "id": "senderRemoved",
  "kind": "system",
  "coordinateSpace": "normalized",
  "fadeDurationMs": 2200,
  "strokes": [
    {
      "color": "#FFFFFF",
      "opacity": 0.7,
      "points": [
        {
          "x": 0.44,
          "y": 0.36
        },
        {
          "x": 0.455,
          "y": 0.375
        },
        {
          "x": 0.47,
          "y": 0.39
        },
        {
          "x": 0.485,
          "y": 0.405
        },
        {
          "x": 0.5,
          "y": 0.42
        },
        {
          "x": 0.515,
          "y": 0.435
        },
        {
          "x": 0.53,
          "y": 0.45
        },
        {
          "x": 0.545,
          "y": 0.465
        },
        {
          "x": 0.56,
          "y": 0.48
        }
      ]
    },
    {
      "color": "#FFFFFF",
      "opacity": 0.7,
      "points": [
        {
          "x": 0.56,
          "y": 0.36
        },
        {
          "x": 0.545,
          "y": 0.375
        },
        {
          "x": 0.53,
          "y": 0.39
        },
        {
          "x": 0.515,
          "y": 0.405
        },
        {
          "x": 0.5,
          "y": 0.42
        },
        {
          "x": 0.485,
          "y": 0.435
        },
        {
          "x": 0.47,
          "y": 0.45
        },
        {
          "x": 0.455,
          "y": 0.465
        },
        {
          "x": 0.44,
          "y": 0.48
        }
      ]
    }
  ]
}
