{
  "id": "modeMessageReceive",
  "kind": "system",
  "coordinateSpace": "normalized",
  "fadeDurationMs": 2200,
  "strokes": [
    {
      "color": "#FFFFFF",
      "points": [
        { "x": 0.39, "y": 0.45 },
        { "x": 0.39, "y": 0.25 },
        { "x": 0.41, "y": 0.19 },
        { "x": 0.45, "y": 0.16 },
        { "x": 0.50, "y": 0.15 },
        { "x": 0.55, "y": 0.16 },
        { "x": 0.59, "y": 0.19 },
        { "x": 0.61, "y": 0.25 },
        { "x": 0.61, "y": 0.45 }
      ]
    },
    {
      "color": "#FFFFFF",
      "points": [
        { "x": 0.39, "y": 0.45 },
        { "x": 0.96, "y": 0.45 }
      ]
    },
    {
      "color": "#FFFFFF",
      "points": [
        { "x": 0.50, "y": 0.15 },
        { "x": 0.75, "y": 0.15 },
        { "x": 0.88, "y": 0.17 },
        { "x": 0.94, "y": 0.22 },
        { "x": 0.96, "y": 0.28 },
        { "x": 0.96, "y": 0.45 }
      ]
    },
    {
      "color": "#FFFFFF",
      "points": [
        { "x": 0.44, "y": 0.28 },
        { "x": 0.56, "y": 0.28 }
      ]
    },
    {
      "color": "#FFFFFF",
      "points": [
        { "x": 0.68, "y": 0.45 },
        { "x": 0.68, "y": 0.85 }
      ]
    },
    {
      "color": "#FFFFFF",
      "points": [
        { "x": 0.15, "y": 0.15 },
        { "x": 0.35, "y": 0.22 },
        { "x": 0.31, "y": 0.34 },
        { "x": 0.11, "y": 0.27 },
        { "x": 0.15, "y": 0.15 }
      ]
    },
    {
      "color": "#FFFFFF",
      "points": [
        { "x": 0.15, "y": 0.15 },
        { "x": 0.25, "y": 0.24 },
        { "x": 0.35, "y": 0.22 }
      ]
    },
    {
      "color": "#FFFFFF",
      "points": [
        { "x": 0.04, "y": 0.12 },
        { "x": 0.08, "y": 0.14 }
      ]
    },
    {
      "color": "#FFFFFF",
      "points": [
        { "x": 0.06, "y": 0.17 },
        { "x": 0.10, "y": 0.19 }
      ]
    },
    {
      "color": "#FFFFFF",
      "points": [
        { "x": 0.06, "y": 0.22 },
        { "x": 0.10, "y": 0.24 }
      ]
    }
  ]
}
