{
  "id": "notificationsOff",
  "kind": "system",
  "coordinateSpace": "normalized",
  "fadeDurationMs": 2200,
  "strokes": [
    {
      "color": "#007AFF",
      "points": [
        {
          "x": 0.42,
          "y": 0.38
        },
        {
          "x": 0.5,
          "y": 0.44
        },
        {
          "x": 0.58,
          "y": 0.38
        }
      ]
    },
    {
      "color": "#007AFF",
      "opacity": 0.7,
      "points": [
        {
          "x": 0.4,
          "y": 0.41
        },
        {
          "x": 0.42,
          "y": 0.41
        },
        {
          "x": 0.44,
          "y": 0.41
        },
        {
          "x": 0.46,
          "y": 0.41
        },
        {
          "x": 0.48,
          "y": 0.41
        },
        {
          "x": 0.5,
          "y": 0.41
        },
        {
          "x": 0.52,
          "y": 0.41
        },
        {
          "x": 0.54,
          "y": 0.41
        },
        {
          "x": 0.56,
          "y": 0.41
        },
        {
          "x": 0.58,
          "y": 0.41
        },
        {
          "x": 0.6,
          "y": 0.41
        }
      ]
    }
  ]
}
