{
  "id": "replayMessage",
  "kind": "system",
  "coordinateSpace": "normalized",
  "fadeDurationMs": 1500,
  "strokes": [
    {
      "color": "#FFFFFF",
      "points": [
        {
          "x": 0.12,
          "y": 0.42
        },
        {
          "x": 0.139,
          "y": 0.4447
        },
        {
          "x": 0.158,
          "y": 0.467
        },
        {
          "x": 0.177,
          "y": 0.4847
        },
        {
          "x": 0.196,
          "y": 0.4961
        },
        {
          "x": 0.215,
          "y": 0.5
        },
        {
          "x": 0.234,
          "y": 0.4961
        },
        {
          "x": 0.253,
          "y": 0.4847
        },
        {
          "x": 0.272,
          "y": 0.467
        },
        {
          "x": 0.291,
          "y": 0.4447
        },
        {
          "x": 0.31,
          "y": 0.42
        },
        {
          "x": 0.329,
          "y": 0.3953
        },
        {
          "x": 0.348,
          "y": 0.373
        },
        {
          "x": 0.367,
          "y": 0.3553
        },
        {
          "x": 0.386,
          "y": 0.3439
        },
        {
          "x": 0.405,
          "y": 0.34
        },
        {
          "x": 0.424,
          "y": 0.3439
        },
        {
          "x": 0.443,
          "y": 0.3553
        },
        {
          "x": 0.462,
          "y": 0.373
        },
        {
          "x": 0.481,
          "y": 0.3953
        },
        {
          "x": 0.5,
          "y": 0.42
        },
        {
          "x": 0.519,
          "y": 0.4447
        },
        {
          "x": 0.538,
          "y": 0.467
        },
        {
          "x": 0.557,
          "y": 0.4847
        },
        {
          "x": 0.576,
          "y": 0.4961
        },
        {
          "x": 0.595,
          "y": 0.5
        },
        {
          "x": 0.614,
          "y": 0.4961
        },
        {
          "x": 0.633,
          "y": 0.4847
        },
        {
          "x": 0.652,
          "y": 0.467
        },
        {
          "x": 0.671,
          "y": 0.4447
        },
        {
          "x": 0.69,
          "y": 0.42
        },
        {
          "x": 0.709,
          "y": 0.3953
        },
        {
          "x": 0.728,
          "y": 0.373
        },
        {
          "x": 0.747,
          "y": 0.3553
        },
        {
          "x": 0.766,
          "y": 0.3439
        },
        {
          "x": 0.785,
          "y": 0.34
        },
        {
          "x": 0.804,
          "y": 0.3439
        },
        {
          "x": 0.823,
          "y": 0.3553
        },
        {
          "x": 0.842,
          "y": 0.373
        },
        {
          "x": 0.861,
          "y": 0.3953
        },
        {
          "x": 0.88,
          "y": 0.42
        }
      ]
    }
  ]
}
