{
  "id": "modeSpecificUserSend",
  "kind": "system",
  "coordinateSpace": "normalized",
  "fadeDurationMs": 2200,
  "strokes": [
    {
      "color": "#333333",
      "points": [
        { "x": 0.15, "y": 0.85 },
        { "x": 0.20, "y": 0.80 },
        { "x": 0.25, "y": 0.75 },
        { "x": 0.30, "y": 0.70 },
        { "x": 0.35, "y": 0.65 },
        { "x": 0.40, "y": 0.60 },
        { "x": 0.45, "y": 0.55 },
        { "x": 0.50, "y": 0.50 }
      ]
    },
    {
      "color": "#333333",
      "points": [
        { "x": 0.85, "y": 0.85 },
        { "x": 0.80, "y": 0.80 },
        { "x": 0.75, "y": 0.75 },
        { "x": 0.70, "y": 0.70 },
        { "x": 0.65, "y": 0.65 },
        { "x": 0.60, "y": 0.60 },
        { "x": 0.55, "y": 0.55 },
        { "x": 0.50, "y": 0.50 }
      ]
    },
    {
      "color": "#333333",
      "points": [
        { "x": 0.35, "y": 0.85 },
        { "x": 0.38, "y": 0.82 },
        { "x": 0.41, "y": 0.79 },
        { "x": 0.44, "y": 0.76 },
        { "x": 0.47, "y": 0.73 },
        { "x": 0.50, "y": 0.70 }
      ]
    },
    {
      "color": "#333333",
      "points": [
        { "x": 0.65, "y": 0.85 },
        { "x": 0.62, "y": 0.82 },
        { "x": 0.59, "y": 0.79 },
        { "x": 0.56, "y": 0.76 },
        { "x": 0.53, "y": 0.73 },
        { "x": 0.50, "y": 0.70 }
      ]
    },
    {
      "color": "#333333",
      "points": [
        { "x": 0.38, "y": 0.38 },
        { "x": 0.35, "y": 0.35 },
        { "x": 0.32, "y": 0.32 },
        { "x": 0.29, "y": 0.29 },
        { "x": 0.26, "y": 0.26 }
      ]
    },
    {
      "color": "#333333",
      "points": [
        { "x": 0.50, "y": 0.38 },
        { "x": 0.50, "y": 0.34 },
        { "x": 0.50, "y": 0.30 },
        { "x": 0.50, "y": 0.26 },
        { "x": 0.50, "y": 0.22 }
      ]
    },
    {
      "color": "#333333",
      "points": [
        { "x": 0.62, "y": 0.38 },
        { "x": 0.65, "y": 0.35 },
        { "x": 0.68, "y": 0.32 },
        { "x": 0.71, "y": 0.29 },
        { "x": 0.74, "y": 0.26 }
      ]
    }
  ]
}
