{
  "id": "nameTraceRegistrationPrompt",
  "kind": "system",
  "coordinateSpace": "normalized",
  "fadeDurationMs": 3500,
  "strokes": [
    {
      "color": "#007AFF",
      "opacity": 0.85,
      "points": [
        {
          "x": 0.14,
          "y": 0.22
        },
        {
          "x": 0.86,
          "y": 0.22
        },
        {
          "x": 0.86,
          "y": 0.58
        },
        {
          "x": 0.14,
          "y": 0.58
        },
        {
          "x": 0.14,
          "y": 0.22
        }
      ]
    },
    {
      "color": "#FFFFFF",
      "opacity": 0.75,
      "points": [
        {
          "x": 0.2,
          "y": 0.42
        },
        {
          "x": 0.22,
          "y": 0.4385
        },
        {
          "x": 0.24,
          "y": 0.4553
        },
        {
          "x": 0.26,
          "y": 0.4685
        },
        {
          "x": 0.28,
          "y": 0.4771
        },
        {
          "x": 0.3,
          "y": 0.48
        },
        {
          "x": 0.32,
          "y": 0.4771
        },
        {
          "x": 0.34,
          "y": 0.4685
        },
        {
          "x": 0.36,
          "y": 0.4553
        },
        {
          "x": 0.38,
          "y": 0.4385
        },
        {
          "x": 0.4,
          "y": 0.42
        },
        {
          "x": 0.42,
          "y": 0.4015
        },
        {
          "x": 0.44,
          "y": 0.3847
        },
        {
          "x": 0.46,
          "y": 0.3715
        },
        {
          "x": 0.48,
          "y": 0.3629
        },
        {
          "x": 0.5,
          "y": 0.36
        },
        {
          "x": 0.52,
          "y": 0.3629
        },
        {
          "x": 0.54,
          "y": 0.3715
        },
        {
          "x": 0.56,
          "y": 0.3847
        },
        {
          "x": 0.58,
          "y": 0.4015
        },
        {
          "x": 0.6,
          "y": 0.42
        },
        {
          "x": 0.62,
          "y": 0.4385
        },
        {
          "x": 0.64,
          "y": 0.4553
        },
        {
          "x": 0.66,
          "y": 0.4685
        },
        {
          "x": 0.68,
          "y": 0.4771
        },
        {
          "x": 0.7,
          "y": 0.48
        },
        {
          "x": 0.72,
          "y": 0.4771
        },
        {
          "x": 0.74,
          "y": 0.4685
        },
        {
          "x": 0.76,
          "y": 0.4553
        },
        {
          "x": 0.78,
          "y": 0.4385
        },
        {
          "x": 0.8,
          "y": 0.42
        }
      ]
    },
    {
      "color": "#007AFF",
      "opacity": 0.5,
      "points": [
        {
          "x": 0.5,
          "y": 0.62
        },
        {
          "x": 0.5,
          "y": 0.63
        },
        {
          "x": 0.5,
          "y": 0.64
        },
        {
          "x": 0.5,
          "y": 0.65
        },
        {
          "x": 0.5,
          "y": 0.66
        },
        {
          "x": 0.5,
          "y": 0.67
        },
        {
          "x": 0.5,
          "y": 0.68
        }
      ]
    }
  ]
}
